"Jun 20, 2021","Teena Mittal","5 out of 5 stars review","Great helmet for modern day use. Tried in rain and better than putting sunglass. No fog to worry about. Rechargeable light is fantastic modern concept to be seen while on road.","Amazing modern helmet","Review from","victgoal.com"
"Mar 2, 2021","Bud Hermann","5 out of 5 stars review","Love the helmet, but the strapping on the neck is uncomfortable. I think a chine strap would be better. Do you know if an alternate chin strap is available.","Nice helmet","Review from","victgoal.com"
"May 19, 2022","Elizabeth Wright","5 out of 5 stars review","I wanted a helmet with goggles this one is very comfortable. I have a few different helmets and I find myself grabbing this one all the time. It came with a missing chin pad and i contacted the seller and they sent one to me. Very nice helmet.","Nice helmet","Review from","victgoal.com"
"Jan 2, 2020","Satishwar Mohan","5 out of 5 stars review","I really like how easy it is to snap on and take off the visor. You can flip the visor upside down if you are mid-ride. I like having the light on the helmet, too.","Built with rider in mind","Review from","victgoal.com"
"Jun 8, 2021","Jaycee Funk","5 out of 5 stars review","I love this helmet especially the sun visor thing. I wear prescription glasses I don't wear sunglasses really, so I really like having that darkened visor on, it works great. And the way it magnetically connects is awesome.","Great helmet","Review from","victgoal.com"
"Jun 25, 2021","Hilton Greenholt","5 out of 5 stars review","This is a great helmet. Comfortable, lightweight and fits perfectly. It's adjustable for those who have a large noggin like myself. Would highly recommend great helmet! Buy it you won't be disappointed","Great helmet! 5 stars!","Review from","victgoal.com"
"Jun 21, 2021","Jobin Sing","5 out of 5 stars review","The helmet fits and works fine. Most importantly, the goggles work well without slippage and cover my upper face well with good ventilation in high temps throughout. I would buy this again.","UV goggles","Review from","victgoal.com"
"Jan 12, 2021","Nicholas Kakooza","5 out of 5 stars review","I like to wait a bit before writing a review to see how the product works. Fits great, breathes well, easy to adjust. The shade shield could hold a little tighter but is great. I would recommend getting one","Good product, nice fit","Review from","victgoal.com"
"Sep 27, 2021","Nonhlanhla Msomi","2 out of 5 stars review","The size of the helmet doesn't fit everyone we got for our son and doesn't fit his head and we cannot find how to buy a bigger size or a smaller one he have the M/l","Nice but the size doesn't fits","Review from","victgoal.com"
"Jun 10, 2021","Mittie Miller","5 out of 5 stars review","The Sun visor is amazing and fits nicely on top of my glasses without any interference. It also helps to screen insects pollens and all types of debris floating in the air. Helmet is lightweight and built-in light is very bold from afar.","Awesome cycle helmet.","Review from","victgoal.com"
"Mar 29, 2020","Brain Feil","5 out of 5 stars review","The shade visor and the red rear light are great features that most helmets do not have. The fit is adjustable and feels snug and comfortable when tuned in. Highly recommended.","Great fit.","Review from","victgoal.com"
"Jul 23, 2022","nicolaas Mnisi","5 out of 5 stars review","Weighs next to nothing, very breathable too. Love the magnetic clip on visors.I've a 63cm head so got the largest size and its a great fit, theres actually room to spare.","Incredibly lightweight!","Review from","victgoal.com"
"Apr 13, 2021","Kayode Akintade","5 out of 5 stars review","Tremendous piece of kit all round. Plenty of adjustment but fits like a glove anyway. Excellent idea having the removable and changeable magnetic goggles and visor. Upgraded helmet light a great improvement. All in all 10/10 and 5 stars. BRILLIANT!!","Price/quality/delivery","Review from","victgoal.com"
"Jun 27, 2022","Preet Majumdar","5 out of 5 stars review","I love this helmet, I waited for review but it fits me perfectly every time I put it on plus I get an extra safety a night with the light at the back of the head as well as a sun shield which makes riding easier for me especially with glasses.","Head protector","Review from","victgoal.com"
"Jul 19, 2022","Chizoba Chidinma","3 out of 5 stars review","I love the lightweight. I'm bald though and it had some pointy ends that are not covered with padding. All it takes is one little spot to be poking you in the head to make you want to tear it off.","Pinching my bald head","Review from","victgoal.com"
"Oct 1, 2020","Leila Biyinzika","2 out of 5 stars review","Visor is hazy and blurry. The helmet is light but the strap is very uncomfortable. The chin guard sits to the side of your ear because they made the straps equal length. The visor sits low on my nose and impedes vision. I returned it.","Blurry visor, uncomfortable straps","Review from","victgoal.com"
"Oct 16, 2021","Bradley Williams","2 out of 5 stars review","I have a smaller head and I needed a size smaller but they only offer one size. So I had to return it. Otherwise, I liked the feel and design of the helmet.","Didn't fit-they only offer one size","Review from","victgoal.com"
"Aug 13, 2021","Ruthe Obol","5 out of 5 stars review","I like the clip on sun screen. It's magnetic but holds quite well. I also like the regular visor. Very easy to interchange. The helmet itself is quite comfortable.","Very comfortable and sturdy","Review from","victgoal.com"
"Jun 30, 2020","Travis Twesigomwe","5 out of 5 stars review","This helmet looks great, has lots of features, is fully adjustable to make it very comfortable, and comes at a a great price! Shipping was also very fast. Great purchase!","Best helmet ever!","Review from","victgoal.com"
"May 22, 2021","Omawunmi Tella","4 out of 5 stars review","Note for 'bent riders only: The magnetic visor doesn't cover your vision as well when you're leaning back a bit as we do. Upright cyclists: Not a problem at all, visor should work a lot like googles only not as hot.","Nice package works as advertised","Review from","victgoal.com"
"May 19, 2022","Kelsie Hermiston","5 out of 5 stars review","Snug fit and breathers when I'm hot.I was knocked off my bike and landed on head looking at the bruising imprint of the helmet on my righthand upper lobe it in my mind and my wife's utterly saved my life","It saved my life after a hit and run. I'm so grateful I'm ordering a new one from this company.","Review from","victgoal.com"
"Aug 5, 2020","Narciso Koelpin","4 out of 5 stars review","I had to return the helmet because it was too big in spite of adjustments. The helmet really was nice but I have a very small head and it was just too loose.","Nice helmet","Review from","victgoal.com"
"Aug 7, 2020","Barnet Biyinzika","5 out of 5 stars review","This is the best helmet I brought since riding bikes and the light in the back is really Kool, now people can see my headlight and I want to say thank you for designing this helmet for I am satisfied. Gooday!!!","Always protect your head when riding bikes because you never know.","Review from","victgoal.com"
"May 13, 2021","Stan Reinger","3 out of 5 stars review","Helmet fit good, magnetic goggle a nice feature. Problem is that the light in rear is not very translucent-not visible in sunlight. This is needed to make you visible to cars approaching in rear.Works well for cloudy, evening use","Light NOT good for daytime use","Review from","victgoal.com"
"Dec 24, 2021","Berniece Jast","5 out of 5 stars review","Well designed, comfortable helmet. Haven't used the visor yet because the only one supplied is dark no good in winter conditions. Supplying a clear visor as well would make this a better package.","Recommended","Review from","victgoal.com"
"Nov 18, 2020","Yakubu Bello","4 out of 5 stars review","Rear light still works and is easy to charge. Visor magnets stronger than previous similar models I've had. Visor is deep enough to keep mud off, but too dark to wear in low light. Would be good to have an alternative / 2nd visor for evening use.","Does the job well","Review from","victgoal.com"
"Oct 14, 2020","Sebastian Edwards","5 out of 5 stars review","Love this lightweight bike helmet with the extra safety features such as the light in back & removable sunglasses. The ventilation is great as well. It is the first bike helmet I've owned, but I couldn't be happier with it.","Great helmet!","Review from","victgoal.com"
"Feb 18, 2021","Patricia Thwala","5 out of 5 stars review","The sun shade and goggles are great for my eyes because I just had surgery and need the protection from the UV rays. The light on the back of the helmet is great for added visibility in fog or low-light to prevent other drivers from hitting me.","Best for all around safety.","Review from","victgoal.com"
"Mar 31, 2021","Abbie Greenfelder","5 out of 5 stars review","Great helmet, fits really well, very light, and the visor is fantastic, you forget you have it on yet it stops the direct sun-glare, really good design overall.","Perfect weight and fit","Review from","victgoal.com"
"Jul 5, 2022","Adedayo Wuraola","5 out of 5 stars review","I absolutely love this Helmet... from the Comfort and Breathability, The very cool and Functional Goggles that have kept so much Sun and Bugs out of my eyes and The very Visible rechargeable light embedded in the design.","BEST HELMET EVER!!!","Review from","victgoal.com"
"Mar 24, 2021","Miguel Cronin","5 out of 5 stars review","I like the visor very much, Just got an extra one for the night (yellow visor) The helmet comes with the dark visor perfect for sunny days, I'm using my medicated glasses with no trouble at all. The back does it job.","Nice fit and comfortable  shape","Review from","victgoal.com"
"Sep 21, 2020","Alfie Wood","5 out of 5 stars review","I really like this helmet. It feels great and I like the look. This works for me.. I am very pleased with this purchase. The seller was fast and very efficient in the delivery. totally happy with every thing.","Real Nice Bike Helmet","Review from","victgoal.com"
"Jul 17, 2020","Linda Dladla","5 out of 5 stars review","Bicycle helmets always looked wonky (opinion). This one has a sleek look and fits very well. Has a solid or blinking light that is easy to recharge. I bought electric bike (awaiting for arrival), but this helmet is bad a$$.","Way cool","Review from","victgoal.com"
"Aug 6, 2021","Gladys Kazibwe","5 out of 5 stars review","Very comfortable, well made. I don't like to buy before I try, but I did anyway and I don't regret buying this helmet! Actually, I purchased one for my wife also and she likes hers also, they look nice and we're reasonable priced! Happy customer!","Quality helmet!","Review from","victgoal.com"
"Oct 15, 2021","Alison Bisheko","2 out of 5 stars review","Ouch ouch ouch. Not for round head shapes. Likely better for oval shapes. Fit and finish isn't great. There are better helmets for the money out there.","Pinches at the temples","Review from","victgoal.com"
"Sep 28, 2020","Niko Cartwright","5 out of 5 stars review","I like the look the style and the comfort of this helmet it has plenty of ventilation and the built-in light is very convenient and also highly safe I don't do much night Rides but when I do I'm seen! Love the detachable goggles and also the visor","Great helmet for the price","Review from","victgoal.com"
"Jan 24, 2021","Adegoke Wasiu","3 out of 5 stars review","Great , light weight , but the red buckle and strap are junk , kept falling off , finally got mad and glued it so it won't fall off . I noticed most brands have this same clasp . The helmet dies fit good , nice red light in back .","Strap sucks ! Helmet good","Review from","victgoal.com"
"Jul 10, 2021","Zella Williamson","5 out of 5 stars review","I ride 100-150 miles a week and just love this helmet. The integrated light works great and is bright. And the visor is a huge improvement over the sunglasses I used to wear. This is a great buy.","Great value","Review from","victgoal.com"
"Mar 14, 2022","Alphonso Braun","5 out of 5 stars review","everything is designed better. 3 way adjust for head strapping, mesh, air flow, on helmet light is bright and configurable. sun glass and visor great fit, design.","everything is designed better than for comparable helmets","Review from","victgoal.com"
"Aug 24, 2020","Amos Osiki","5 out of 5 stars review","I like everything about this helmet. Quality material, adjustable fit, great design and eye shield provides enough room to wear glasses behind it.Also, company personnel are fast to respond to any questions.","Well worth it","Review from","victgoal.com"
"Aug 31, 2021","Esse Ademayowa","5 out of 5 stars review","I love this helmet. The fact that it comes with a tinted visor to protect your eyes is a great feature. It attaches via magnets so it's easy to put on as well as remove.","Great helmet","Review from","victgoal.com"
"Mar 3, 2021","Harold Kassulke","3 out of 5 stars review","The helmet is great. My problem is that it was supposed to come with detachable sun shade, and that item was not in the box. If it was included, as advertised, I would have given the helmet 5 stars. But, I hate paying for something I did not get.","This is a comfortable, light, and good-fitting helmet","Review from","victgoal.com"
"Mar 28, 2021","Carole Huel","5 out of 5 stars review","Visor clips on easily, sun shade bit magnets on instantly if required, easy to adjust size and its very comfortable to wear and light is easy to operate","Comfortable, easy to attach parts, looks good","Review from","victgoal.com"
"Oct 26, 2021","Gertrude Mugisha","5 out of 5 stars review","The strap is easy to adjust. The inner mesh is washable and comfortable. I've owned a couple of helmets over the years and this one has great airflow and accommodates my giant head.The led light is a bonus.","Worth the money","Review from","victgoal.com"
"Oct 27, 2020","Ressie Morissette","3 out of 5 stars review","Good for the price. The visor is low quality plastic. The center piece holding it broke day 1 and its just hanging with the side ones and I wouldn't be surprised if it flies off one day while riding. Other than that, its an ok helmet","Its okay. Not great","Review from","victgoal.com"
"Oct 23, 2021","Gulab Chaudhary","5 out of 5 stars review","My head is the size of a child's and could never find an adult helmet to fit but I loved this one. I love the lights and to make it fit my head I wear a Beenie underneath. A bit warm, but safety first!","Helmet","Review from","victgoal.com"
"Jun 27, 2021","Quentin Hill","5 out of 5 stars review","This bike helmet is amazing. It breathes really well so your head doesn't get as hot. I love the face shield. I plan on ordering one of the yellow shields for night/dark rides.","Purchase this now!","Review from","victgoal.com"
"May 13, 2021","Bethel Friesen","5 out of 5 stars review","This is my 2nd Victgoal helmet. They fit great; the inside pads are easy to remove and clean. Easy to adjust the straps. They add protection as it is designed to, yet comfortable. The color scheme matches my bike colors.","Goggles protect against bugs in your eye","Review from","victgoal.com"
"Feb 25, 2021","Dax Nabimanya","5 out of 5 stars review","The helmet fits great, looks great, and will save your brain. If you use the detachable faceshield with a balaclava like I do, make sure you treat it with some anti-fog stuff.","Save your brain","Review from","victgoal.com"
"Feb 28, 2022","Lewis Baker","4 out of 5 stars review","Great idea / concept but for me I need to wear glasses underneath the magnetic visor and that was impossible for me anyway, also didn't find the helmet very comfortable compared to another make of helmet I have, shame it kinda looks cool.","Great concept ""But""","Review from","victgoal.com"
"Jul 16, 2021","Abbigail Walsh","5 out of 5 stars review","first i thought it's look like Aeroplane helmet but i found this is very usefull it's protect my eyes from wind and very comfortable to wear .just love it thought it's costly..","ultra light  and smart helmets for bike","Review from","victgoal.com"
"Oct 31, 2020","Arthur Saunders","5 out of 5 stars review","I was concerned it would not fit. I adjusted perfectly. The silver and blue are great. This is my first bike helmet ever.can not wait to use is when I get my new ebike in a couple of weeks.","It adjust to my head size.","Review from","victgoal.com"
"May 20, 2021","Makenna Yost","4 out of 5 stars review","good designed helmet and lightweight , just fits my head which measures 60cm , the magnetic visor fits securely does not detach going over bumps have not used the rear light so cant comment on , handy bag for cycling and carrying helmet","cycle helmet","Review from","victgoal.com"
"Nov 23, 2020","Chelsea Robinson","5 out of 5 stars review","I was going to return it because it wouldn't fit my head. My head is small so I have to adjust it a couple of times on the straps. The removable sunglasses feature is very helpful. thumb up!  The light on the helmet is pretty helpful too.","Love it!","Review from","victgoal.com"
"Mar 8, 2022","Tessie Graham","5 out of 5 stars review","Absoutely essential foriding in the city. Visibility is critical. Good charge time on the light, abot 4 continous hours from what I can calculate. A very small nose is necessary in order to use the eye shield., without rubbing against it.","High visibility","Review from","victgoal.com"
"Sep 14, 2021","Hulda Effertz","4 out of 5 stars review","Helmet is a comfortable fit, visor is a handy extra, that can be left off if not required, decent light on the back, overall I'm satisfied with the purchase","Comfortable helmet","Review from","victgoal.com"
"Feb 13, 2022","Varun Sani","4 out of 5 stars review","The helmet is comfortable and I've received compliments on in whole riding with my local race team, the visor is a bit dark tho so I...   recommend buying a clear one if your riding at night or low light conditions","It's a helmet","Review from","victgoal.com"
"Jul 23, 2021","Michelle Ddamulira","5 out of 5 stars review","It fits perfectly, very well made and comfortable. Visor and magnetic sun shades really makes the Victgoal Bike helmet looks very professional and expensive.","Victgoal Bike Helmet is the one to get.","Review from","victgoal.com"
"Sep 16, 2021","Kimberly Lee","5 out of 5 stars review","I am really happy with this helmet. It is light weight. Magnetic goggles are very good. I usually go on long bike rides. At times I forget I am wearing these goggles since they are so comfortable.","Good product","Review from","victgoal.com"
"Jun 17, 2021","Lalit Sidhu","5 out of 5 stars review","This is the most comfortable cycle helmet i have ever bought. The tinted eye screen is amazing and i never thought id use it. I wear glasses and this cover fits over them with space.It is quality gear that suits my needs.","Most comfortable cycle helmet ive ever had","Review from","victgoal.com"
"Mar 21, 2022","Caleb Abayisenga","5 out of 5 stars review","I have bought two of these now - one for me and one for my 23 yr old daughter. I have brown and she has fluorescent green/yellow - both are super comfortable. Hers has the improved back light which is fantastic. Highly recommend!","Brilliant helmet","Review from","victgoal.com"
"May 6, 2022","Abigail Anthony","5 out of 5 stars review","I love the way it looks and feels, easy to tighten and expand. The extra sun clip has magnets and makes it easy to put on and take off. Definitely recommend it.","Great helmet","Review from","victgoal.com"
"Jul 5, 2021","Claire Ross","5 out of 5 stars review","It is comfortable, has a sun visor which is vital in a bike helmet, and has a magnetic eye shield which keeps wind from tearing up my eyes. Very nice!","Nice bike helmet!","Review from","victgoal.com"
"Jul 12, 2021","Melissa Parker","5 out of 5 stars review","Seems a nice helmet, love the visor and the fact it comes with a bag, the light on the back could always be brighter for daylight use but it's not bad","Comfortable","Review from","victgoal.com"
"Jun 16, 2021","Ramesh Banik","5 out of 5 stars review","I am so happy with this helmet! It is so light and I love the design! It looks so cool and the features exceeded my expectations! Very comfortable for everyday use! I love the chin strap too! Thanks Victgoal!","This helmet is so cool!","Review from","victgoal.com"
"Jun 25, 2022","Ujwal Mehra","5 out of 5 stars review","Great quality product really protects your head comfortable to wear easy to adjust the vizier is excellent it keeps the cold out of your eyes and keeps the sun rays from dazzling you good value for money","Tough at the top","Review from","victgoal.com"
"Aug 5, 2021","Andrew Clarke","5 out of 5 stars review","Really like it, cool shape and style.Best feature is the magnet visor.Led light on the back is a nice feature.Very adjustable and comfortable.Feels strong and safe, although I'm not keen on testing this out on a car.","Cool, Sleek, Sturdy","Review from","victgoal.com"
"Mar 19, 2021","Brad Nienow","5 out of 5 stars review","Great Helmet.Its fits perfect, very comfortable, looks sleek, and the visor is a great addition.The Flashing light on the back of the helmet is very cool.Love it!","Quality!","Review from","victgoal.com"
"May 31, 2021","Gabriel Ferreira","3 out of 5 stars review","The Sunshield Is Very Uncomfortable, cuys into the bridge of nose.I wore it for one season, the chin strap does not get snug enough, the padding by the forehead deterirated.Of most concern is the sun shield cutting into my nose.","The Sunshield Is Very Uncomfortable, cuys into the bridge of nose.","Review from","victgoal.com"
"Jul 1, 2021","Himani Walia","3 out of 5 stars review","The light dont charge i received a replacement and that doesn't charge either very disappointed with the item charged for hours and nothing i would like a refund for the faulty light but il keep the helmet","Decent helmet but light don't charge","Review from","victgoal.com"
"Oct 30, 2021","Lolade Aligbe","5 out of 5 stars review","This helmet provides comfortable and lightweight full head coverage. The added feature of an easy reachable rear light is a plus. For people who appreciate proactive safety and have something to protect, this helmet is a nice , reasonable choice.","Comfortable safe coverage.","Review from","victgoal.com"
"May 6, 2022","Cole Spencer","5 out of 5 stars review","Husband and I have very much enjoyed the helmets. They have been comfortable and I like the red light in the back. Husband has used the clip on shield and says it's easy and nice to use. We would buy these helmets again.","Comfortable","Review from","victgoal.com"
"Apr 13, 2021","Selina Lee","5 out of 5 stars review","This item is all that I asked for. Really comfortable and very lightweight and the visor is brilliant. The light on the back is also really good. Highly recommended","Bike helmet","Review from","victgoal.com"
"Jun 5, 2021","Autumn Grimes","5 out of 5 stars review","This helmet looks good and the fit is easily adjustable, even while riding. The rechargeable safety light works well and is easy to use and recharge. And at this price it is quite a value.","Great Helmet","Review from","victgoal.com"
"Sep 5, 2021","sifiso White","4 out of 5 stars review","The rear light is more visible to drivers since it's up on my head, not under my seat. The batteries last a long time and are rechargeable. The goggles are more effective than sunglasses and I can wear my regular glasses under them.","I love the goggles and rear light.","Review from","victgoal.com"
"May 5, 2020","Sydni Dare","5 out of 5 stars review","Excellent budget helmet. I was in the Trek shop the other day and picked up one of their $200 helmets too see if it was substantially lighter, it was not. For my purposes this helmet is perfect. I've been using it daily for a couple of weeks now.","Excellent Value","Review from","victgoal.com"
"Aug 12, 2020","Fabian Kovacek","5 out of 5 stars review","It's what I was hoping it would be. Has a visor, a face shield or can wear it free of either. Plus the light on the back makes you feel a little bit safer! Plenty of options.","Awesome helmet!","Review from","victgoal.com"
"Apr 9, 2021","Boitumelo Brits","5 out of 5 stars review","Good rear blinking light?Check!Cool, super strong magnet, magnetically attached sunglasses visor?Check!Prevents a concrete-to-forehead concussion and road-rash that would sand off your ear?Check!Seriously, it's a good helmet. It's worth it.","It looks just as cool as you think it does.","Review from","victgoal.com"
"Nov 5, 2021","Porter Lind","5 out of 5 stars review","Great helmet for riding with awesome ventilation, durability, and style. It's perfect for night riding because of the light on back. 10/10 Helmet for the price!","Comfortable, Durable & Affordable","Review from","victgoal.com"
"Jun 8, 2022","Daniel Price","5 out of 5 stars review","Nice helmet. Has slots for airflow. Like the snap on magnet feature for eye protection. Really like the red light on back of helmet. Size is adjustable with brackets.","Get it","Review from","victgoal.com"
"Jul 25, 2021","Gunjan Divan","5 out of 5 stars review","This helmet has a dial that allows you to get a custom fit, very cool. It also has a light on the back that has 3 settings (constant light or 2 flashing modes) Lightweight, too.","Adjustable fit & more","Review from","victgoal.com"
