"f7","f7 2","w_iUH7","tl-m","w_kV33","gray","gray 2"
"Jul 11, 2025","David","5 out of 5 stars review","Stylish helmet, enjoy the goggles keeps road grime and wind on the eyes. The addition of the rear safety light great idea.","","",""
"Oct 12, 2025","Jackie","5 out of 5 stars review","Bike helmet fits excellent, well  worth the price!
The padding fits great and adjusting to fit is easy.","Helmet","",""
"Nov 25, 2025","tirelover","5 out of 5 stars review","visor was kind of hard to put on.but light works good.fit was kinda hard to do.but i got it.nice helmet","","",""
"Mar 10, 2025","Joel","5 out of 5 stars review","Comfortable fit, light weight.  The sun visor is a life saver as i tend to sweat a lot and wearing normal sunglasses while biking gets irritating as i have to clean them costantly.","","",""
"Nov 30, 2024","Doug","5 out of 5 stars review","Amazing! Adjusts for perfect fit by turning a simple knob in the back! Light is awesome with multiple settings. Mask detaches and attaches easily. This helmet has it all!","Buy!","",""
"Dec 16, 2024","zenmaster318","5 out of 5 stars review","First off, the color is awesome. It is one size adjustable. Neck strap is comfortable.  The magnetic shade is excellent too. Rear red rechargable helmet light is awesome too. price is great as well. I wear this helmet everytime i am out on my ebike. i highly recommend it.","","",""
"Aug 5, 2025","pencilman2010","4 out of 5 stars review","I already said but the middle piece was VERY hard to snap in, I almost gave up. also, I put in for a return/refund but says I have to take it to a Walmart, I DON'T HAVE A CAR!","I put in for a return/refund","",""
"Oct 10, 2025","Tadgh","1 out of 5 stars review","Can't get the sun visor to stay on. The magnetic eye shade curls so far back its riding on and irritating the bridge of your nose. The chin strap won't stay snug where you want it. Overall the helmet is very uncomfortable and particularly so in the back where the light is. Total waste of money. I bought another new helmet which works and just threw this one away","","",""
"Aug 14, 2025","tibebu","1 out of 5 stars review","Victgoal material arrived damaged. The Victgoal helmet is heavy %26 very disconfortable to wear. Victgoal is expensive too. 
Victgoal  has the worest customer service.
Victgoal refunds with Paypal.
Be aware-Buy from somewhere else. Or  buy from local stores. Don't buy Victgoal.","","",""
"Nov 5, 2025","Arturo","5 out of 5 stars review","it's perfect, fits me just right and was delivered on time.","","",""
"Nov 8, 2025","Rossie","5 out of 5 stars review","This is a very nice helmet looks good fits good comfortable lite weight, I love it.","Helmet","",""
"Aug 22, 2025","James","5 out of 5 stars review","Great item delivered fast, 5 star service 👍","Awesome service","",""
"Aug 4, 2025","Ernest","5 out of 5 stars review","love the sunglass visor magnetic attachment easy to use","","",""
"Nov 13, 2025","Ernest","5 out of 5 stars review","awesome helmets and excellent materials","","",""
"May 28, 2025","Greg","5 out of 5 stars review","love the magnetic visor.  and rear flashing light","","",""
"Jun 3, 2025","Jesse","4 out of 5 stars review","still rolling with it, preffered.","","",""
"Sep 20, 2025","vernon","5 out of 5 stars review","love this helmet,just wish the light was a lot brighter.","","",""
"Aug 20, 2025","JOHN","5 out of 5 stars review","fits well and looks.good
built.well","","",""
"Jun 2, 2025","Eugene","1 out of 5 stars review","the helmet wasn't what I paid for it does not even fit me the helmets way too","","",""
"Aug 14, 2025","Hector","5 out of 5 stars review","fits well, comfortable,good quality 
I love the fact that it has a light on the back of the helmet. money well spent thank you.","","",""
"Aug 28, 2025","Jerry","5 out of 5 stars review","adjust for any size by a simple turn of a dial, even while wearing. I love the magnetic sun shield","","",""
"Aug 20, 2025","karen","5 out of 5 stars review","Great light on the back to let others know that you are biking. Comfortable and well put together","","",""
"Aug 30, 2025","anonymous","5 out of 5 stars review","Open the package grandson  does not want to wear the helmet.","Never opened","",""
"Sep 10, 2025","Cynthia","5 out of 5 stars review","Very comfortable easy to customize the fit. Made well","Comfortable helmet","",""
"Aug 23, 2025","Alexander","5 out of 5 stars review","Great quality and appearance","","",""
"Apr 11, 2025","Jeffry","5 out of 5 stars review","arrived on time. just what i  ordered. i love the back light on it and the fact that its rechargeable","","",""
"Apr 8, 2025","Jose","5 out of 5 stars review","Nice helmet, goog quality","Nice","",""
"Jul 24, 2025","Margaret","5 out of 5 stars review","style, fit, accessories, price.  excellent value","","",""
"Apr 22, 2025","michelle","5 out of 5 stars review","Love the color and the cool features!","","",""
"Jun 29, 2025","Illia","5 out of 5 stars review","Nice! Versatile, looks good, feels good, and light!","","",""
"Apr 5, 2025","Eric","5 out of 5 stars review","Fits well, looks good. Thank you.","","",""
"Aug 11, 2025","anonymous","5 out of 5 stars review","love the light on the back of the helmet.","","",""
"Aug 2, 2025","cheryl","5 out of 5 stars review","color is nice, fits perfectly and comes with a eyeshield","","",""
"Jul 29, 2025","Luis","5 out of 5 stars review","Great quality and exactly what I need it","","",""
"Mar 18, 2025","Guri","5 out of 5 stars review","Best product light weight and easy to fit","","",""
"Jun 10, 2025","Mark","5 out of 5 stars review","I am completely satisfied with my helmet  .","","",""
"May 13, 2025","Dan","5 out of 5 stars review","It was just as it looked, very nice helmet","","",""
"Mar 7, 2025","Rosario","5 out of 5 stars review","Great helmet. came in a great time.","","",""
"Jan 21, 2025","WalmartCustomer","5 out of 5 stars review","It is well built and fits perfectly. The accessories are easy to use.","Great helmet for the price.","",""
"Dec 3, 2024","Anna","5 out of 5 stars review","fits very comfortably. visor shades wonderfully","","",""
"Jun 9, 2025","Antonio","5 out of 5 stars review","Excellent stylish and comfortable bike helmet at a very affordable price.","","",""
"Dec 22, 2024","PAT","4 out of 5 stars review","Very comfortable, fits is good and lightweight. Adjustable and vents.","","",""
"Nov 23, 2024","Wayne","5 out of 5 stars review","Looks great and fits perfect! Would recommend. The light in the back is great.","Great Helmet","",""
"May 11, 2025","Juan","5 out of 5 stars review","Excellent quality. Stylish while keeping you safe. Charging is easy and the magnets work perfectly.","Recommended","",""
"Jul 21, 2024","Shophereallot","5 out of 5 stars review","The helmet was easy to adjust to fit. Really like the front shield.  My wife likes the way the back light flashs.","Safe noggin","",""
"Jul 31, 2025","MIKE","5 out of 5 stars review","visibility is great.","","",""
"Mar 7, 2025","Codrington","5 out of 5 stars review","Not too bad","","",""
"Aug 7, 2023","Walmart customer","5 out of 5 stars review","No assembly instructions visor snaps on goggles magnetic mounts. All in all great bike helmet I like the way it looks. Safety light for night, visor and goggles sunlight. Well vented for our flow. Excellent if you're safety conches bike rider with an aggressive style.","Good Quality Good Perches","",""
"May 13, 2024","Jody","1 out of 5 stars review","You should have a more accurate idea of your available stock. When you over sell to make sure you get the most, you do a disservice to your customers. Now I don't get my item, and I get to wait 10 days for my refund. Imagine the interest you can make on thousands of unfulfilled orders.","Over sold the item so had to cancel my order.","",""
"May 17, 2024","Charlie","5 out of 5 stars review","I love this Helmet. I am 6'4'' tall with a weight mass of 240lbs and when I was online searching for this Helmet, the description said adjustable to fit all. Well that absolutely correct.  All descriptions of this Helmet are absolutely correct.
Some was selling this Helmet around $70 not including tax and shipping fees, thanks Walmart.","Satisfied Fit..","",""
"Oct 20, 2023","Joe","5 out of 5 stars review","I've only used this once so far, but I can't find anything that would be considered a con or negative which is the best thing about it. It feels great and fits perfect without moving around; I've never had a helmet with such a great fit. It shipped free via Fedex and was delivered 14 hours after I made the purchase; not sure how that was possible. The visor clicks on easily. The sunglasses stay on securely with magnets yet they're very easy to remove and install; not sure I'm going to use them very often, but it seems like a nice option to have (would really be great for someone who wears glasses for vision). The rechargeable battery is great also and the charge port is extremely easy to access. The light isn't particularly bright, but it should be effective at night when you need it; it isn't going to help in daylight. This is really a well thought out product at a great value for the money.","Great fit and quality. Outstanding value.","",""
"Mar 8, 2024","bingo9","5 out of 5 stars review","This helmet seems to be of pretty good quality.  It fits nicely and has enough adjustments.  The magnetic visor is new for me and I am still learning to use it.  I think it will be something that I'll like once I get accustomed to it.  I have always worn sunglasses to ride so the visor is nice to have for wind protection for my eyes.  I had used my old helmet for 14 years and red that they should be replaced after 5, so that was my motivation.","Nice fitting helmet.","",""
"Feb 16, 2024","Fredrick","5 out of 5 stars review","I found every feature of this helmet more than met my expectations. Only wish I could wear my glasses under the clear magnetic eye visors but this proved to be a negotiable  inconvenience. They cut down on the sun's glear like a good pair of sunglasses. I very much liked the flashing light on the rear of the helmet that added to my visibility while riding at night.","this is a very good product","",""
"Sep 10, 2022","rodney","5 out of 5 stars review","Freaking awesome helmet! Magnetic goggles snap on and snap off like magic. Rear tail light USB rechargeable on back of helmet. Cool style and well ventilated. Made from quality material. Would pay double the price if I ever had to replace it. One of the very best items I've ever bought.","Freaking awesome helmet!","",""
"May 13, 2024","Moosegunk","1 out of 5 stars review","Although marketed as an ""adult"" sized helmet which will fit up to 24"", this helmet is clearly marked ""M"" and ""Medium"". Adjusted to the maximum, it barely fit my 23"" head, snuggly.

The visor sits too low, causing the wearer to crane their head uncomfortably upward to see out from under it.

The goggles rub uncomfortably on the bridge of my nose which is not large, They aren't wearable without modification.

The light seems to work fine.","Not the best ""adult"" sized helmet","",""
"Sep 26, 2024","ebikeridder","5 out of 5 stars review","Not many helmets have a shield. This worked well for a person who wears glasses. I got the adult L size. Better to have head room rather than be to tight. I wished it had the option of a clear shield.  This site has this for $20 less than the actual brand site. js I went to the brand site and got a clear shield :-)","Nice to have eye shield helmat","",""
"Jul 5, 2023","frederick","5 out of 5 stars review","It's got a good Fit, The Googles work great for riding on Shaded Trails. it keeps insects and direct wind out of my eyes, Googles are easy to remove for cleaning. When wearing the helmet  googles are about a ¼” above my nose. The Visor works good to put more air into the helmet.","Wearing a Helmet is no Hassle","",""
"Nov 2, 2023","Jonathon","5 out of 5 stars review","I feel like I'm a Tour de France rider wearing this helmet I love the adjustable settings it's super easy and the magnetic visor stays on with some very strong magnets. Also the light on the back last a long time and is rechargeable very easy and one of the best helmets I've owned","Coolest helmet ever!","",""
"Dec 13, 2024","Paul","1 out of 5 stars review","The order I'm sure is lost. It keeps saying it's delayed and on its way.","","",""
"Aug 12, 2024","Greg","5 out of 5 stars review","Helmet just as described. I love it!","","",""
"Oct 6, 2024","Tyrone","4 out of 5 stars review","Nice helmet, The visor comes off really easy.","","",""
"Sep 30, 2024","Robert","5 out of 5 stars review","nifty helmet, really nice visor that attaches magnetically","Nifty Helmet","",""
"Oct 3, 2024","Beverly","5 out of 5 stars review","Light weight, yet strong !","","",""
"Dec 31, 2024","karen","5 out of 5 stars review","lights on helmet","","",""
"Jan 21, 2025","Patrick","5 out of 5 stars review","Great bike helmet","","",""
"Jun 4, 2025","Aundra","5 out of 5 stars review","Thank you….nice helmet","","",""
"Mar 11, 2025","anonymous","4 out of 5 stars review","Nice, too small for me","Review","",""
"Mar 2, 2025","Jeffrey","5 out of 5 stars review","Great item","","",""
"Apr 16, 2025","Lawrence","5 out of 5 stars review","Fantastic!","","",""
"Aug 14, 2023","Eric","5 out of 5 stars review","I loved the visor and that it is magnetically attached. I also love the 3 light modes on the back of the helmet that can be cycled through by pressing the button. Looks very cool.","Great Helmet","",""
"Apr 6, 2024","jenriqueusa","5 out of 5 stars review","It feels really comfortable, light but strong. The light has three modes and you can see them clear at a good distance. How good it looks, it's just a neat bonus.  Happy customer","Highly recomended","",""
"Sep 21, 2023","Gail","5 out of 5 stars review","Surprising lightweight and functional, love the “safety” light feature on the back.  The magnetic sunshield (visor) is awesome.  Well worth the money.","Great Features","",""
"Nov 15, 2023","Kayden","5 out of 5 stars review","Loves his new helmet, adult size gives  him room to grow. The goggles %26 back of helmet with the light with 3 settings is great. Such a safety helmet. Very best purchase.","","",""
"Apr 5, 2024","Muckjr","5 out of 5 stars review","Solid Fit. The adjustable headband is the Bomb. Feels secure, doesn't slide around. Rechargeable light, magnetic tinted visor, easy on %26 off. Best bike helmet I've ever had.","Awesome","",""
"Sep 22, 2022","rodney","5 out of 5 stars review","This is my second Helmer, but I'm actually buying it for a friend. I showed him how freaking cool mine was and he had to have one too. It's an incredibly well made helmet and extremely cool looking.","Money well spent","",""
"Feb 2, 2023","Nima","5 out of 5 stars review","looks and feels good. I am super excited!
the quality seems good. the functions are great. you can put on and take of the visor easily because it has magnets.","Happy to have it","",""
"Oct 3, 2024","Walmart customer","5 out of 5 stars review","I like the light on the back of the helmet and the sun visor on the front of the helmet, like that the helmet is light weight and lets a lot of air flow through it.","Light and airy","",""
"Jul 7, 2024","Rafeal","5 out of 5 stars review","I like it so much","","",""
"Sep 15, 2024","Nikkimenaj","5 out of 5 stars review","Saved my life","Thank you God","",""
"Jan 17, 2025","Bernice","5 out of 5 stars review","Excellent head gear","","",""
"Nov 20, 2023","Mary","1 out of 5 stars review","The first one was the wrong color. The replacement arrived severely damaged. I am trying to get a label to return it.","","",""
"Dec 26, 2023","J","2 out of 5 stars review","I got this for my son but when it was delivered in was a women's bike helmet.  I will be returning it.","Bummed!","",""
"Nov 8, 2022","Dawn","5 out of 5 stars review","Love the fit and color love the reflective stitching and rear light just don't like that the plug part does not come with the wires.","Nice Helmet!","",""
"Sep 8, 2023","Walmart customer","5 out of 5 stars review","They are very comfortable and look great. I like that it has the flashing light on the back for night time.g","","",""
"May 4, 2024","Tom","5 out of 5 stars review","It fits so well and looks good! Love the shaded shield to protect from bugs and wind buffeting around my eyes! It's truly great!","Helmet","",""
"May 1, 2024","Michael","5 out of 5 stars review","I like this helmet. it fits well. light is visible. The eye shield is very handy, would like it if it had a clear one also.","Great helmet","",""
"Feb 2, 2024","Walmart customer","5 out of 5 stars review","love the helmet good air flow like the light in the back of  the helmet.  light weight. like the visor also.","great helmet","",""
"Mar 26, 2024","Matthew","5 out of 5 stars review","Great Helmet! Great color! I got the blue with orange trim! Fits well great visor and comfortable!","Great versatile helmet. nice colors!","",""
"May 28, 2024","Harry","5 out of 5 stars review","It is or soon but buy the look it is of good quality. I will keep this review posted.Guedo","Good helmet","",""
"Aug 14, 2023","Scotty","2 out of 5 stars review","Didn't like how crooked the visor fits on the helmet very uneven totally can tell looks terrible","Visor doesn't fit helmet correctly","",""
"Sep 6, 2023","Lavelle","5 out of 5 stars review","ngwt loads of compliments on this and the battery is still going strong","great purchase","",""
"Dec 6, 2023","MABEL","5 out of 5 stars review","it was so fast!
it will be a gift so review will be provided later","","",""
"Aug 3, 2023","Russell","5 out of 5 stars review","better than quality than what is carried in the stor","","",""
"Sep 11, 2023","Daniel","5 out of 5 stars review","I like the USB rechargeable led in the back","","",""
"Feb 6, 2024","Stephen","5 out of 5 stars review","As described in description and the light is nice also that's it's rechargeable","TBD","",""
"Jun 1, 2023","George","5 out of 5 stars review","Beautiful helmet.  Fits perfectly and looks great","","",""
"May 16, 2024","Shawn","5 out of 5 stars review","Love it   Exactly what I paid for. 
 lightweight and breathable","Great value and quality","",""
"Apr 18, 2023","Kermit","5 out of 5 stars review","The helmet fits great like the light feature goggles don't fit over glasses","Good","",""
"Oct 15, 2023","Rene","5 out of 5 stars review","I like the weight the design the easy accessory assembly and how it feels on my head.","awesome helmet.","",""
"Mar 17, 2024","leonard","5 out of 5 stars review","lightweight and fits good","good product","",""
"Sep 27, 2023","Carol","3 out of 5 stars review","I have a smaller head so could not get the straps comfortable and secure","Not short enough straps","",""
"Jul 10, 2020","Pauline Wright","3 out of 5 stars review","I was very disappointed with the process I needed to go through to attach the visor. The pegs on the visor were just too big for the grommets on the helmet. One went in easily, but I needed to use a dremel tool to widen the other two holes. Not the quality I would expect for the price. The helmet should have shipped with the visor attached.","Visor should be attached","Review from","victgoal.com"
"Jul 9, 2022","Marilyne Atukunda","5 out of 5 stars review","Love this helmet comfortable, light weight and I unfortunately put it to a test this morning I flipped my bike crossing a railroad track (@ about 16mph) on a paved road. The helmet did exactly what it was supposed to! I didn't realize my head had hit the ground because the helmet took the impact. Only when I inspected the helmet I realized how hard I hit.","Crashed with helmet. Didn't even know my head hit the ground","Review from","victgoal.com"
"Sep 11, 2021","Shawna Ritchie","5 out of 5 stars review","This helmet is very comfortable to wear and doesn't feel top heavy at all. It's worth every penny and the sun visor is perfect by itself. What makes this helmet worth it is the visor has plenty of room for sun glasses if you want to wear them. Highly recommended if you're looking for a great helmet.","Excellent","Review from","victgoal.com"
"Aug 9, 2021","Christopher Visser","4 out of 5 stars review","Perfect worth the money, but I'd advise to by multiple visors the night (yellow) and clear ones in particular. I found the standard one that comes with is near useless in terms of visibility at dawn(had to take it off) overall durable and will do a job whatever bike you decide to ride will it be a racer or mountain bike.","DES VULT!","Review from","victgoal.com"
"Oct 16, 2019","Maria Tamale","5 out of 5 stars review","I bought 2 of these... each arrived as if it had already been dropped or scraped.. the paint was blemished out of the box. I returned both fearing if it was this delicate already (new) it wouldn't look great after wearing it a few weeks.REVISED RATINGthe seller reached out to me and was very concerned about my issues I was having with my previous orders. They made sure to send me a helmet without blemishes and followed up to make sure I was happy with my purchase. I ended up buy an additional helmet (same seller and brand) and it too came flawless. I do recommend this seller and this product. If it does come damaged, they will make it right!","Blemished paint 2 orders (REVISED)","Review from","victgoal.com"
"Jan 23, 2022","Chloe White","4 out of 5 stars review","Bought this as a replacement to my old helmet that sacrificed itself while doing its job when I was sideswiped by a MGIF idiot car driver.Only used it once so far. It's very stiff, even the interior padding, it's not as comfortable as my old helmet and the airflow wasn't as good, I sweated - a lot and this was during a ride at 6am on a January morning where the temperature was 1 degree. Time will tell but if it remains like this I can't see myself using it when the weather gets warmer.","Seems sturdy","Review from","victgoal.com"
"Jun 12, 2021","Jacques Ondricka","5 out of 5 stars review","Love this helmet lightweight comfortable Love the visor and the USB rechargeable light on the back of the helmet so there is no battery replacement if you use the light. It comes with a magnetic goggle to attach which works great for attaching and removing easily it said you could flip the goggles upside down if you wanted to not stop using it but keep it on the helmet I have not figured out how to do that with the visor in place. Highly recommend this helmet it has all the bells and whistles.","Love this helmet it has all the bells and whistles You could possibly ask for","Review from","victgoal.com"
"Aug 21, 2021","Thomas Richardson","5 out of 5 stars review","I really like this product. The quick click sun glass is really cool it holds tight during ride but can be pull off with ease. Led light in back work well, nice and bright with multiple settings(I use the blinking one). Very light feeling. I really have enjoyed this helmet.","FANTASTIC!","Review from","victgoal.com"
"May 29, 2020","Lizzie Ross","5 out of 5 stars review","Looks great.I don't use the visor as it is not practical for me.USB-Rechargeable light is a bonus. Although the light is not visible during the day, at night it is probably visible for 20 feet . So don't rely on that for safety, use a powerful tail light (which typically cost more than this whole helmet.)","So far so good","Review from","victgoal.com"
"Oct 28, 2021","Parminder Nagarajan","5 out of 5 stars review","I really like this helmet, the fit is perfect and the visors clip in place magnetically they are secure and are just plain great. I ordered extra visors in case they get scratched and thay will. All visors of this type will get scrathed. My favorite visor I have is the multy colored one. Sure the light in the back of the helmet isn't very bright but big deal, you shouldn't rely on just that light. Any seasoned biker knows you need more than one light on the back of your bike. Anyway I gave it five stars because it deserves it especially for the price.","Super satisifed","Review from","victgoal.com"
"Oct 24, 2020","Herman Zulu","4 out of 5 stars review","Reasonable helmet. Light, but feels reasonably sturdy. I don't find it so comfortable or secure on my head, doesn't seem to fit my head shape. On the other hand, OH finds it ok for him. Comes with a bag to store it in. Goggles and visor are not attached on arrival but easy to do so. You don't have to have either on; can have none, one or both. I'm not sure the visor would stand up to being put on and off a lot, so best to pick on or off and leave it so. The goggles hold on a lot firmer than I thought they would even though they're held on with magnets. Because of where they're held on the helmet, you can actually wear glasses at the same time which is a bonus. However, I don't find the goggles are in a good position really, seem too high up and don't fully cover my glasses; it's good if you have your head down and just use your eyes to look up as they offer sun protection, but it just feels a little odd. OH didn't mind so much (doesn't wear glasses), so maybe it's just me, or the way it sits on my head! Padded chin strap and rechargeable light with variable light pattern on the back of the helmet (small charging lead included). Easily adjustable for a range of head sizes.","Decent helmet for the price, but with some issues","Review from","victgoal.com"
